{
  "generated_at": "2026-10-12T02:20:32.845251+00:00",
  "sample": true,
  "source_count": 53,
  "note": "Clearly-labeled SAMPLE derived from editorial seed topics (data/trends.json). Not live data — for consumer development only.",
  "trends": [
    {
      "id": "six-seven-meme",
      "title": "\"6-7\" — Gen Alpha's defining brainrot joke",
      "source": "Wikipedia",
      "url": "https://en.wikipedia.org/wiki/6-7_(meme)",
      "velocity": 92,
      "opportunity_score": 92,
      "hashtags": [
        "#67",
        "#sixseven",
        "#brainrot"
      ],
      "detected_at": "2026-09-01T00:00:00-07:00",
      "summary": "Born from Skrilla's viral TikTok song \"Doot Doot\" and LaMelo Ball edits, the phrase \"six-seveeeeen\" exploded across classrooms worldwide. South Park aired a parody episode on Oct 15. Random, meaningless, inescapable — the signature joke of Gen Alpha internet culture.",
      "category": "meme",
      "platforms": [
        "tiktok",
        "youtube"
      ],
      "format_tags": [
        "meme"
      ],
      "sources": [
        "Wikipedia"
      ],
      "trend_type": "format"
    },
    {
      "id": "gta6-robberies",
      "title": "GTA 6: robberies and partner getaways detailed",
      "source": "Game8",
      "url": "https://game8.co/articles/latest/this-weeks-gaming-news-roundup-oct-4-to-oct-10",
      "velocity": 91,
      "opportunity_score": 91,
      "hashtags": [
        "#gta6",
        "#rockstar"
      ],
      "detected_at": "2026-10-08T00:00:00-07:00",
      "summary": "Rockstar gave a closer look at how GTA 6 wants players to plan crimes — robberies and partner getaways front and center. Every crumb of GTA 6 news moves the entire gaming internet.",
      "category": "gaming",
      "platforms": [
        "youtube",
        "tiktok",
        "x"
      ],
      "format_tags": [],
      "sources": [
        "Game8"
      ],
      "trend_type": "topic"
    },
    {
      "id": "seis-sete-dance",
      "title": "\"Six Seven\" (Seis Sete) funk dance",
      "source": "Lightreel",
      "url": "https://lightreel.ai/blogs/whats-trending-on-tiktok",
      "velocity": 90,
      "opportunity_score": 90,
      "hashtags": [
        "#sixseven",
        "#seissete",
        "#dancechallenge"
      ],
      "detected_at": "2026-09-20T00:00:00-07:00",
      "summary": "Brazilian funk track with finger-counting choreography and a shrug on the beat — the dominant dance challenge on TikTok right now, amplified by J-Hope (BTS) to 75M+ views. Crossed every demographic from Japanese high schoolers to WWE creators.",
      "category": "meme",
      "platforms": [
        "tiktok"
      ],
      "format_tags": [
        "dance"
      ],
      "sources": [
        "Lightreel"
      ],
      "trend_type": "format"
    },
    {
      "id": "trump-rally-nobel",
      "title": "Trump roasts rally protester; Nobel Prize outrage",
      "source": "RedWaveFeed",
      "url": "https://www.redwavefeed.com/trending",
      "velocity": 90,
      "opportunity_score": 90,
      "hashtags": [
        "#trump",
        "#nobelprize"
      ],
      "detected_at": "2026-10-11T00:00:00-07:00",
      "summary": "October 11's top US political story: Trump roasting a rally protester on stage plus outrage over the Nobel Prize. Political clip content is the highest-velocity, highest-risk lane — massive views, massive comment wars.",
      "category": "news",
      "platforms": [
        "x",
        "youtube",
        "tiktok"
      ],
      "format_tags": [],
      "sources": [
        "RedWaveFeed"
      ],
      "trend_type": "topic"
    },
    {
      "id": "houthi-riyadh-strike",
      "title": "Houthi missile strike on Riyadh airport",
      "source": "NewsWatchmen",
      "url": "https://newswatchmen.com/2026/10/11/news-watchman-daily-news-brief-sunday-october-11-2026/",
      "velocity": 88,
      "opportunity_score": 88,
      "hashtags": [
        "#riyadh",
        "#middleeast",
        "#breaking"
      ],
      "detected_at": "2026-10-11T00:00:00-07:00",
      "summary": "A Houthi missile strike on Riyadh's international airport reportedly killed at least 12 and injured hundreds — fears of major Middle East escalation. Breaking-news explainers always spike; maps and timelines win.",
      "category": "news",
      "platforms": [
        "youtube",
        "x"
      ],
      "format_tags": [],
      "sources": [
        "NewsWatchmen"
      ],
      "trend_type": "topic"
    },
    {
      "id": "nba-tiktok-surge",
      "title": "#nba explodes on TikTok (+493%)",
      "source": "Revid",
      "url": "https://www.revid.ai/tiktok-viral-trends-today",
      "velocity": 86,
      "opportunity_score": 86,
      "hashtags": [
        "#nba",
        "#basketball"
      ],
      "detected_at": "2026-10-11T00:00:00-07:00",
      "summary": "Per Revid's tracking, #nba is the fastest-rising hashtag in popular TikTok posts this week — up 493% to 59 posts, with #roblox also climbing at +164%. Preseason storylines + highlight culture = the algorithm's favorite sport right now.",
      "category": "sports",
      "platforms": [
        "tiktok"
      ],
      "format_tags": [],
      "sources": [
        "Revid"
      ],
      "trend_type": "topic"
    },
    {
      "id": "we-fell-in-love-in-october",
      "title": "\"we fell in love in october\" — girl in red",
      "source": "SocialPilot",
      "url": "https://www.socialpilot.co/blog/tiktok-trends",
      "velocity": 86,
      "opportunity_score": 86,
      "hashtags": [
        "#wefellinloveinoctober",
        "#octobermood"
      ],
      "detected_at": "2026-10-01T00:00:00-07:00",
      "summary": "girl in red's \"we fell in love in october\" (1.8M videos) is back for its yearly October run — the soft guitar bed for pumpkin-patch dates, fall outfits, and cozy montages. Stage: Peak per SocialPilot (Sept 25–Oct 10, 2026): participation works, but a strong angle is non-negotiable.",
      "category": "meme",
      "platforms": [
        "tiktok",
        "instagram"
      ],
      "format_tags": [],
      "sources": [
        "SocialPilot"
      ],
      "trend_type": "topic"
    },
    {
      "id": "nana-patekar-tributes",
      "title": "Nana Patekar dies at 75 — meme legend tributes",
      "source": "Face of Malawi",
      "url": "https://www.faceofmalawi.com/2026/10/09/nana-patekar-dies-at-75-the-viral-meme-legend-whose-hilarious-reactions-took-over-the-internet/",
      "velocity": 85,
      "opportunity_score": 85,
      "hashtags": [
        "#nanapatekar",
        "#riplegend"
      ],
      "detected_at": "2026-10-08T00:00:00-07:00",
      "summary": "Veteran Indian actor Nana Patekar died Oct 8 in Goa of a suspected cardiac arrest. Beyond three National Film Awards and the Padma Shri, he was the face of a thousand reaction memes — the drink-spit take, Uday Shetty's laugh. The internet is mourning and remixing his most iconic clips.",
      "category": "meme",
      "platforms": [
        "x",
        "instagram",
        "youtube"
      ],
      "format_tags": [
        "meme"
      ],
      "sources": [
        "Face of Malawi"
      ],
      "trend_type": "format"
    },
    {
      "id": "dip-on-em",
      "title": "\"DIP ON EM\" — early-stage dance sound",
      "source": "SocialPilot",
      "url": "https://www.socialpilot.co/blog/tiktok-trends",
      "velocity": 85,
      "opportunity_score": 85,
      "hashtags": [
        "#diponem",
        "#dancechallenge"
      ],
      "detected_at": "2026-10-08T00:00:00-07:00",
      "summary": "EARLY-stage dance sound (49.3K videos): \"DIP ON EM\" by SouthMemphisHypeman — an easy one- or two-person bounce that big dance creators picked up this week. SocialPilot's call (Sept 25–Oct 10, 2026): film a clean one-take while it's still under 50K videos. The lowest-competition dance sound on the board.",
      "category": "meme",
      "platforms": [
        "tiktok"
      ],
      "format_tags": [
        "dance"
      ],
      "sources": [
        "SocialPilot"
      ],
      "trend_type": "format"
    },
    {
      "id": "insomniac-lofi",
      "title": "\"Insomniac\" — Memo Boy's lo-fi bed",
      "source": "SocialPilot",
      "url": "https://www.socialpilot.co/blog/tiktok-trends",
      "velocity": 84,
      "opportunity_score": 84,
      "hashtags": [
        "#insomniac",
        "#lofi",
        "#fallvibes"
      ],
      "detected_at": "2026-10-01T00:00:00-07:00",
      "summary": "Memo Boy's \"Insomniac\" (518.7K videos): the dreamy lo-fi bed showing up across fall scenery, room makeovers, and slow Halloween decor pans. Stage: Peak — and it's business-approved, so brand accounts can use it straight from a business account (SocialPilot, Sept 25–Oct 10, 2026).",
      "category": "meme",
      "platforms": [
        "tiktok"
      ],
      "format_tags": [],
      "sources": [
        "SocialPilot"
      ],
      "trend_type": "topic"
    },
    {
      "id": "spooky-skeletons-remix",
      "title": "\"Spooky, Scary Skeletons\" House VIP Remix",
      "source": "SocialPilot",
      "url": "https://www.socialpilot.co/blog/tiktok-trends",
      "velocity": 84,
      "opportunity_score": 84,
      "hashtags": [
        "#spookyseason",
        "#halloweendecor"
      ],
      "detected_at": "2026-10-01T00:00:00-07:00",
      "summary": "Crystal Knives & Lex Allen's house remix of the Halloween classic (1.3M videos, Peak): the upbeat bed for countdowns, quick decor cuts, and spooky food reveals. Business-approved — bakeries, restaurants, and party stores can run their Halloween menu or aisle on it (SocialPilot, Sept 25–Oct 10, 2026).",
      "category": "meme",
      "platforms": [
        "tiktok"
      ],
      "format_tags": [],
      "sources": [
        "SocialPilot"
      ],
      "trend_type": "topic"
    },
    {
      "id": "31-days-of-halloween",
      "title": "\"31 Days of Halloween\" numbered series",
      "source": "SocialPilot",